房源名称,面积,租金,单平米租金
北苑路北 林奥嘉园 2居改3居室2卫 可整租可分租押0月付,128,10800,84.375
零押金+月付 北苑路北 精装三居室 可同事合租 有钥匙 随时,118,10300,87.28813559
临5 北苑路北 林奥嘉园 精装小次卧 守公园 拎包入住,31,2170,70
北苑媒体村美立方精装大开间 朝南 家具家电齐全 拎包入住 急,45,4200,93.33333333
北苑 美立方 精装一居室 全明格局 采光好 看房随时,65,5200,80
北苑媒体村美立方精装复式大两居 客厅 使用120平 急租,60,6800,113.3333333
媒体村天居园133平米 房 有钥匙,133,8500,63.90977444
北苑媒体村精装大开间 房子没出租过 看房有钥匙 拎包入住,65,5200,80
北苑媒体村天居园 精装大一居 南向带阳台 全装全配 拎包入住,88,6300,71.59090909
媒体村天畅园 182平租金可谈 精装修 位置好,182,16500,90.65934066
北苑媒体村、精装大三居、大开间、看房有钥匙、出入方便,170,10500,61.76470588
北苑媒体村天畅园 精装空房三居 可以 南向采光好开放小区,133,9200,69.17293233
北苑媒体村天畅园、大开间、可出租、看房有钥匙、,135,12500,92.59259259
华贸城东区 2室1厅2卫个人,106,7000,66.03773585
"北苑立水桥新上旭辉奥都一居,落地窗,干净好住5600亲自实勘",60,5600,93.33333333
北苑家园望春园 婚房两居室 集中供暖 可月付 拎包住 近5,108,7500,69.44444444
绣菊园精装南北三居室可朋友合住 随时看房 地铁北苑站菜市,108,8199,75.91666667
北苑筑华年正规三居室出租 真实图片 可同事合住 随时看房入住,100,7500,75
北苑筑华年 南北精装大两居 业主直租 看房随时 拎包入住,84,7500,89.28571429
旭辉26街区两室好房出租 承接房屋代理托管 刚收房!,38,4200,110.5263158
"乐想汇精装开间,干净整洁,房子装修不错,可0押金可月付",52,5580,107.3076923
立水桥南新上 旭辉奥都 精装两居 可零押金月付 300米铁,80,6900,86.25
北苑家园 旭辉奥都 燃气开间 家电齐全 采光好 拎包住,50,4880,97.6
北苑家园 莲葩园 温馨两居两卫 家电齐全 采光好 0押金月付,108,6999,64.80555556
北苑家园 莲葩园 精装两居 干净整洁高层 采光好 0押月付,70,5880,84
北苑立水桥旭辉奥都60平大开间 采光好 铁近 0押月付,60,4900,81.66666667
"北京华贸城 空房.可配齐家具,可办.公可居家 南向无遮挡",67,7000,104.4776119
北苑站华贸城新上大三 豪华装修 真实照片看房方便 可押0付一,100,8600,86
"舒适,温馨,大气,现代于一身的业主自+住房豪华装修可拎包入住",220,22000,100
豪装150平大三居红木家具 北苑家园 华发颐园 旭辉奥都,140,12800,91.42857143
东方郁金香新上开间 步行两分到立水桥站 干净整洁0押月付,45,4450,98.88888889
出门立水桥南站口 精装正规两居 装修好 干净整洁温馨,80,6999,87.4875
"乐想汇精装开间,干净整洁,房子装修不错,可0押金可月付",52,5580,107.3076923
零押月付 旭辉奥都 华贸城 绣菊园 精装温馨开间 干净到不行,60,5600,93.33333333
北五环望春园旭辉奥都婚房两居头回出租家具全齐0押月付,90,6900,76.66666667
北苑家园 旭辉奥都 华贸城 精装超温馨开间业主直租价格便.宜,50,4800,96
立水桥南300米 旭辉奥都 望春园 精装燃气温馨一居业主直租,60,5800,96.66666667
旭辉26街区两室好房出租 承接房屋代理托管 刚收房!,38,4000,105.2631579
北苑 立水桥 华发颐园 140平南北三居 家电齐全 零押月付,140,12500,89.28571429
天怡家园 3室2厅2卫个人,130,10700,82.30769231
"13北苑 润泽悦溪 公馆 精装修环境优美,交通便利,地段",60,6980,116.3333333
5北苑天怡家园 望春园 大三居 看房随时 0押金,108,9200,85.18518519
13北苑家园 紫绶园正规南北三居室 家具家电齐全 可同事合住,94,7700,81.91489362
北苑 傲城融富中心 三室两厅两卫 整租 零押金,170,17000,100
"5号线立水桥南,茉藜园清友有附近,绣菊园精装4居可同事合住",121,8200,67.76859504
13号线城铁北苑 华贸城世华泊郡 精装正规三居 看房随时,130,10000,76.92307692
北苑站13号线 润泽悦溪 精装2居 家具家电齐全 拎包入住,87,8000,91.95402299
领地精装一居全墙壁纸拎包入住家电全配0押月付,72,5600,77.77777778
新上婚房装修自带落地飘窗5号城铁立水桥南旁华发颐园,60,5700,95
北京华贸城精装复式 近铁13号线 可居家可 0押金月付,106,7200,67.9245283
精装1居 房子干净+不容错过+家电齐全+北苑家园茉藜园望春园,66,5500,83.33333333
温馨两居 干净整洁温馨两居 北苑家园 旭辉奥都 0押金可月,74,6100,82.43243243
朝阳北苑 乐想汇小区 精装开间周边配套齐全 0押金可月付,53,4920,92.83018868
领地精装一居全墙壁纸拎包入住家电全配0押月付,72,5600,77.77777778
"华贸城超精装2次元两居,便利交通,大气",88,8800,100
"北京华贸城 空房。可配齐家具,南向无遮挡",53,7600,143.3962264
北苑 上元君庭 万科星园 精装一居室 租房送健康 怀抱奥森,66,7300,110.6060606
铁建花语城豪装两居 南北通透 家电家具齐全 环境优美,91,7800,85.71428571
佳兴园旁北苑6号院精装三居室 家具齐全 有钥匙 随时看房,95,8300,87.36842105
佳兴园旁北苑6号院精装三居室 家具齐全 有钥匙 随时看房,95,8300,87.36842105
佳兴园旁北苑6号院精装三居室 家具齐全 有钥匙 随时看房,95,8300,87.36842105
佳兴园旁北苑6号院精装三居室 家具齐全 有钥匙 随时看房,95,8300,87.36842105
朝阳北苑 乐想汇小区 精装开间周边配套齐全 0押金可月付,53,4920,92.83018868
"乐想汇精装开间,干净整洁,楼下商圈,可0押金可月付",74,6280,84.86486486
5号线立水桥南望春园 清友园精装俩居室 诚意出租随时恭候看房,96,6800,70.83333333
北苑 立水桥 东小口公园 茉藜园 精装两居 家具齐全押0付,93,6500,69.89247312
北苑家园望春园新上两居 随时看房 业主好说话 押0付1,98,6500,66.32653061
北苑家园望春园 茉藜园 板楼2居 精装修 看房提前约,118,7100,60.16949153
豪华主卧独卫.低调古典奢华仅.此一套.北苑望春园.旭辉奥都,45,3850,85.55555556
北苑豪华厅隔.低调古典奢华+北苑望春园.旭辉奥都0押月付,50,3999,79.98
0押金月付 北京城建次方 华贸城精装三居 干净整洁空间宽敞,130,7700,59.23076923
旭辉奥都 望春园 精美开间改两居 全墙壁纸 干净整洁 城铁,60,5800,96.66666667
世茂奥临花园 3室 南北通透 217平 25000元,217,25000,115.2073733
"乐想汇精装开间,干净整洁,房子装修不错,可0押金可月付",52,5580,107.3076923
北苑家园绣菊园精装一居全墙壁纸拎包入住家电全配0押月付,72,5600,77.77777778
铁建国际城豪装三居 人车分流 采光好 配套齐全 干净整洁,118,10000,84.74576271
"0押金 精装温馨 茉藜园新出2居,干净清爽家电全配,交通便利",90,7600,84.44444444
北苑 万科星园 力迈国际 奥森公园 精装 含车位,125,14000,112
北苑 万科星园 力迈国际 奥森公园 精装 含车位,125,14000,112
北苑 万科星园 力迈国际 奥森公园 精装 含车位,126,14000,111.1111111
北苑 万科星园 力迈国际 奥森公园 精装 含车位,125,14000,112
北苑 旭辉奥都 精装两居 婚房 5号.线立水桥南站,96,7500,78.125
(地铁五号线)北苑望春园精装大2居 业主直租 价位能谈,103,7800,75.72815534
立水桥南茉藜园精装两居、超格、家具齐全、随时入住!!,118,6000,50.84745763
北苑家园望春园 三居两卫 业主直租 看房打电话,90,9500,105.5555556
北苑 立水桥南站 筑华年 二改三 同事同学 合租好房集中供暖,100,8200,82
假壹赔百!真实图片!北苑筑华年三居7400元出租!可同事合住,100,7400,74
"5号线立水桥南,华发颐园婚房三居旭辉奥都美立方望春园附近北辰",122,12000,98.36065574
北苑家园 单间出租 房子干净 看房随时,20,2500,125
物业直租 北苑美立方 华发颐园旭辉奥都 一居室 随时入租,50,5100,102
物业出租望春园 华发颐园旭辉奥都拎包入住 随时入住,90,7500,83.33333333
全墙壁纸+精装两居.业主首出租 北苑家园望春园+旭辉奥都0押,88,7450,84.65909091
北苑媒体村 好房 视野好 看房有钥匙随时能用 看房方便,165,11500,69.6969697
"北苑+全智能房+豪华三居三卫花园洋房,鸟语花香,山水蓝维",210,22600,107.6190476
全墙壁纸+豪装两居+南北通透+润泽悦溪+北苑华贸城+零押月付,90,8100,90
"物业直租,立水桥南,旭辉奥都,单间,限女生",10,1000,100
"物业直租,立水桥南,旭辉奥都,单间,限女生住",10,1000,100
"物业直租,立水桥南,旭辉奥都,单间,限女生住",10,1000,100
"物业直租,立水桥南,旭辉奥都,单间,限女生住",10,1000,100
新上茉藜园南北双卫两居!婚房首租!租给一家人!随时看房,99,6875,69.44444444
城铁立水桥南北苑家园豪装婚房2室2卫 一样租金不一样感受,118,6600,55.93220339
5号线立水桥南望春园 清友园精装俩居室 诚意出租随时恭候看房,96,6800,70.83333333
新上温馨一居室!旭辉奥都、铁127米!婚房首租、月付房租!,50,4900,98
立水桥南旭辉奥都婚房一居首租情侣专属铁288米!!,50,4800,96
北苑 山水欧雷山 豪装三居 带花园 真正好房!租!有钥匙,160,11500,71.875
新上 业主直租 世华泊郡 全南两居 欧式装修 可长签 随时住,89,8000,89.88764045
新出北苑 城建世华泊郡 业主长期出租 豪华三居 随时住,139,11000,79.13669065
北苑 美立方 精装两居 (押零付一)5号线 立水桥南站,65,6700,103.0769231
"北苑媒体村天畅园,立水桥北方明珠170出租,",170,15500,91.17647059
北苑5号13号线 紫绶园精装正规两居室 出门公交 易事达广场,95,6000,63.15789474
北京城建世华泊郡精装南北三居室出租 小区 人车分流,135,11500,85.18518519
立水桥南站 美立方 精装复式 的优先选择,112,10000,89.28571429
5号.线立水桥南站 望春园新出南北通透两居室 小区环境优美,116,7300,62.93103448
北苑地铁13号线 采光充足 周边配套设施成熟 地铁,52,7800,150
"铁13号线华贸城精装三居室家电齐全,看房方便",95,10200,107.3684211
精装修+婚房温馨两居 全南向 全墙壁纸 真.实照片 真.实价格,90,7000,77.77777778
全智能家居+超豪华主卧独卫+全墙壁纸+华发颐园 旭辉,50,4200,84
150平豪华装修大三居+可同事合住+华发颐园 旭辉奥都+0押,150,13600,90.66666667
山水蓝维新上南北通透大三居 业主头回出租 有钥匙 随时看房,210,23000,109.5238095
山水蓝维新上南北大三居 业主头会出租 有钥匙 看房方便,210,23000,109.5238095
山水蓝维新上南北大三居 小区环境 临北苑东路 京承高速,210,210,1
"平安嘉苑佳兴园三居,装修好,近,看房方便",120,10300,85.83333333
北苑路北站 万科星园 1室1厅 随时看房 就一套 有钥匙,65,6600,101.5384615
北苑 万科星园 豪装三居室 拎包入住 交通便利,148,13000,87.83783784
豪装 奥森公园北门 林奥家园 大两居 集中供暖 临 铁,140,10000,71.42857143
奥森公园北门 林奥嘉园 5 精装主卧独卫 0押金,35,3800,108.5714286
北苑媒体村天居园 精装打两局 拎包入住 干净整洁 着急出租,84,8000,95.23809524
北苑媒体村天畅园 182平租金可谈 精装修 位置,182,17000,93.40659341
急租媒体村天畅园旁傲城融富 大一居房 有钥匙 随时看房,76,8000,105.2631579
北苑家园 上元君庭 近5 近奥林匹克公园 拎包住,120,9000,75
"拂林园,奥森,纵赏绿色,全南大三居,舒适,看房提前约",153,11700,76.47058824
恒大名都精装修西向开间出租 月付无押金 交通便利,60,5000,83.33333333
出门 美立方平安嘉苑精装婚房开间出租拎包入住 先看,60,5400,90
恒大名都 正规大两居 出租 新装修没有住过 随时看房,85,6300,74.11764706
0押金月付 来北家园一居室 出门公交站 家电齐全 看房随时,60,4800,80
媒体村天畅园西南向186平米空房有钥匙出租装修好,156,15000,96.15384615
北苑天怡家园 美立方精装一居室 家具家电齐全 看房有钥匙 5,66,5300,80.3030303
北苑 望春园 旭辉奥都精装一居室出租 拎包入住家电齐全 居家选择,68,5200,76.47058824
天怡家园 精装两居室 把边户型 全明格局 有钥匙 随时看,89,6500,73.03370787
北苑城锦苑 筑华年主卧次卧出租 交通便利 拎包入住 随时看房,20,2200,110
来北家园 相寓精装一居室 集中供暖 拎包入住 随时看房,55,4500,81.81818182
天润福熙大道 1室 南北通透 61平 7700元,61,7700,126.2295082
原始南北三居室改成了七居室,170,15000,88.23529412
上元君庭 南北通透带三个飘窗装修保养好,101,10000,99.00990099
旭辉奥都美立方 华发颐园 大2居,90,6800,75.55555556
物业出租收费5折 华发颐园旭辉奥都,100,6800,68
物业出租 北苑 华发颐园 美立方 旭辉奥都,90,6400,71.11111111
物业直租媒体村华发颐园旭辉奥都社区,100,7300,73
北苑媒体村北美立方 旭辉奥都 精装1居室用金5折,50,4700,94
北苑媒体村 美立方华发颐园旭辉奥都婚房首次出租,55,5300,96.36363636
北苑美立方华发颐园 望春园旭辉奥都 精装1居室,65,5000,76.92307692
北苑望春园 旭辉奥都拎包入住 物业出租,90,6200,68.88888889
物业出租 媒体村北苑美立方北旭辉奥都拎包入住精装2居室,95,7200,75.78947368
北苑立水桥旭辉奥都地下室仓储 出租 不可,30,1000,33.33333333
物业直租北苑立水桥华发颐园旭辉奥都60平一居室 主册,60,5300,88.33333333
物业出租北苑 华发颐园 旭辉奥都精装一居 拎包入住,60,5500,91.66666667
北苑 立水桥 旭辉奥都精装出租,90,7500,83.33333333
物业出租 北苑立水桥 望春园旭辉奥都精装2居室,90,7400,82.22222222
物业直租 北苑 华发颐园 望春园 旭辉奥都精装修2居室,90,7200,80
物业出租 北苑立水桥旭辉奥都 精装2居室,92,7000,76.08695652
物业出租中介5折 华发颐园 望春园 旭辉奥都,92,7200,78.26086957
物业出租5折费用 华发颐园望春园旭辉奥都精装修2居室,92,7500,81.52173913
北苑立水桥 华发颐园旭辉奥都,90,6900,76.66666667
北苑立水桥 华发颐园旭辉奥都,90,6800,75.55555556
北苑家园铁立水桥南华发颐园旭辉奥都,90,7200,80
物业出租 望春园 华发颐园 旭辉奥都110平大2居,110,7500,68.18181818
物业出租 美立方 华发颐园旭辉奥都,110,7500,68.18181818
物业出租 美立方 华发颐园 旭辉奥都 南北通透;拎包入住,90,7500,83.33333333
物业出租望春园 华发颐园 旭辉奥都两居室,75,6800,90.66666667
物业出租北苑华发颐园旭辉奥都 一居室,50,5200,104
物业出租 随时入组 望春园 华发颐园 旭辉奥都 1居室,49,5100,104.0816327
物业出租 华发颐园望春园 旭辉奥都一室一厅,56,5500,98.21428571
物业直租 北苑华发颐园媒体村 旭辉奥都地下仓储仓库,60,1600,26.66666667
物业出租华发颐园旭辉奥都精装大一居室 随时入住,70,5300,75.71428571
物业直租媒体村美立方 华发颐园旭辉奥都随时入住,50,4800,96
物业出租 北苑华发颐园 旭辉奥都 精装修 随时入住,45,4900,108.8888889
物业出租美立方华发颐园旭辉奥都随时入住,43,4700,109.3023256
物业出租 美立方 华发颐园旭辉奥都 精装2居室,90,7300,81.11111111
北苑立水桥 媒体村 旭辉奥都 仓储出租,25,1000,40
物业出租北苑美立方 华发颐园旭辉奥都,50,4900,98
物业直租北苑 媒体村 旭辉奥都 地下仓库 不可,30,1200,40
物业直租北苑 媒体村 旭辉奥都 地下仓库 仓储不可主人,60,1600,26.66666667
"绣菊园.南区 南北通透阳光充足,欢迎入住",9,1600,177.7777778
物业出租 北苑华发颐园 美立方旭辉奥都拎包入住 主册,60,5500,91.66666667
"青山绿水,鸟语花香朝阳北苑近奥森天畅园交通方便氛围好",179,17000,94.97206704
朝阳北苑近奥森世茂奥临花园正规三居室有钥匙随时看房,198,24000,121.2121212
奥森 万科星园 豪华大两居 落地圆弧大飘窗 高层观景俯瞰奥森,97,9000,92.78350515
"天畅园8号楼,中楼层,宽敞明亮,方便利用",165,16500,100
北苑 傲城融富中心 三室两厅两卫 整租 零押金,170,17000,100
傲城融富中心 房出租 随时看房 先到先得哦,165,17500,106.0606061
押0月付 北苑家园 清友园南北通透精装三居 可同事合住,120,11000,91.66666667
北苑 佳兴园 精装三居 业主出租 看房联系,136,10500,77.20588235
5号立水桥南站 北苑家园望春园 精装三居两卫好房源,133,10000,75.18796992
朝阳北苑 媒体村天畅园 奥森公园旁 精美三居室 城铁,185,17000,91.89189189
"媒体村天畅园187平西南三居室,方便,方便看房",182,16800,92.30769231
"北苑5号天畅园大面积房,随时入住,采光不错,布局好有钥匙",186,17000,91.39784946
北苑拂林园旁万科星园东西3居室观奥森 整体橱柜 随时看房,158,12500,79.11392405
"北苑北卫新园经典四居室,精装修,格局好,看房方便 随时入住",179,13000,72.62569832
北卫新园156平南北向三居室家私齐全双阳台宽敞明亮,156,11500,73.71794872
"舒适,温馨,大气,现代于一身的房东房出租,可拎包入住",80,6100,76.25
北苑家园 立水桥南绣菊园 精装两居室 家电齐全 0押金可月付,115,8650,75.2173913
清友园新出三居室 价格便宜 有钥匙 随时看房零押金月付,100,8000,80
立水桥南 旭辉奥都 南向精装两居7500,90,7500,83.33333333
北苑+5号线+北苑路北站+拂林园+内置+精装两居+急租,125,8500,68
小区中间位置 不受外部环境干扰 没噪音 少污染,138,8700,63.04347826
北苑5号线立水桥南站 望春园 精装两居两卫 随时入住 免押金,129,8200,63.56589147
朝阳北苑奥森北门林奥嘉园正规两居室随时可看房,130,11500,88.46153846
"茫茫人海相遇即是有缘,选择我让您租房无忧租后无忧,随时可看",126,12500,99.20634921
"茫茫人海相遇即是有缘,您给我一分信赖,必还您十分满意,随时看",198,24000,121.2121212
华发颐园 精装大2居 铁 户型方正 环境优美 押0月付,98,8300,84.69387755
精装铁房 68平南向打2居 朝向好 铁近婚房首租,68,6200,91.17647059
北苑茉藜园精装2室2卫 出门有公交 铁5分、 拎包住,105,6800,64.76190476
奥森北门世茂奥临豪华大三居 观景房 安立路 3分五环,175,16800,96
旭辉奥都精装 60平大开间带阳台 婚房首租 房租月付近铁,60,5100,85
新上旭辉奥都老业主头回租 优先一家人 看房随时!,89,6750,75.84269663
免押金 精装一居 媒体村 居家好房 近铁,68,5350,78.67647059
"望春园,三居,主卧 次卧 厅隔出租干净整洁,可拎包入住",128,2450,19.140625
"旭辉奥都新出1室户,干净清爽家电全配,交通便利配套齐全",68,6300,92.64705882
"世茂奥临花园新出3室户,干净清爽家电全配,交通便利配套齐全",179,25000,139.6648045
"天翠园豪装两居两卫,采光好,随时看房,高楼层,零压月付,",129,10300,79.84496124
美立方 新出婚房复式 装修好 业主出租 看房随时,65,6200,95.38461538
"北苑朝阳北苑茉藜园,温泉水入户,主卧独卫,随时入",30,3300,110
北苑 润泽公馆 精装两居室华贸城旁边 可长签 交通便利,96,7350,76.5625
北苑家园茉藜园 主卧 家具家电全齐 集中地暖 随时入住 近铁,30,1900,63.33333333
北苑润泽公馆合租城铁13好近采光好配套全,20,2800,140
零押金 房租月付 主卧独卫 家电家具齐全 随时看房,25,3200,128
大!13北苑站 朝南石墙小两居 北苑家园国际城,75,6200,82.66666667
5和13 新家具新家电 北苑大主卧+阳台 看房有,25,2050,82
实拍 业主直租 华贸城两居 之前业主 看房打电话,100,7500,75
零押金 房租月付 家电家具齐全 随时看房,90,6700,74.44444444
零押金 房租月付 真是照片 随时看房,100,7800,78
零押金 房租月付 家电家具齐全 随时看房,15,1700,113.3333333
"清友园精装主卧,面积大,采光好,拎包入住,随时看房,零压月付",25,3350,134
"润泽公馆主卧独卫,家电齐全,采光好,小区环境优美,随时看房",26,3600,138.4615385
北苑13 豪装大三居 家具家电齐全 拎包入住 免押金月付,156,12000,76.92307692
北苑路北铁站 媒体村天畅园 精装大房 交通方便 能停车,133,9500,71.42857143
精装一居 家电齐全 拎包入住 看房提前约,59,5200,88.13559322
朝阳北苑北苑家园 茉藜园 精装两居室 家具家电齐全 拎包入住,78,7000,89.74358974
北苑 仰山桥林奥嘉园两居室朝南合租厅隔南北通透 奥森北门,30,2600,86.66666667
北苑天月园旁拂林园朝南主卧带阳台家具齐全 有钥匙随时看房,27,2400,88.88888889
北苑奥森北园 豪宅三居 南北通透 拎包入住 看房有钥匙,120,11000,91.66666667
北苑朝来绿色家园 南北通透大三居 房东急租 拎包入住,138,10500,76.08695652
北苑5北苑路北站 豪装四居室 拎包入住 好房速,148,11000,74.32432432
"天居园豪装两居两卫 交通便利 小区环境好,业主直租,看房方便",111,9800,88.28828829
急租福熙大道精装两居 南北通透4居2卫 居家全齐 随时看房,171,13500,78.94736842
13北苑站润泽悦溪两居 业主装修 可长签拎包住,89,7900,88.76404494
北苑立水桥 望春园 新上铁两居 家电齐全 0押月付 有钥匙,103,7350,71.3592233
北苑望春园 大三居双卫 可签三年 装修好 头次出租 实图!!,135,9200,68.14814815
"急租北辰家园拂林园新出2室户,干净清爽家电全配,看房方便",126,9200,73.01587302
城铁北苑13清友园 精装南北三居 有钥匙看房随时 长签,100,7900,79
新上 润泽公馆 业主 欧式南北三居 可长签 随时住,156,12000,76.92307692
北苑家园绣菊园两居 房租月付 随时看房,102,6000,58.82352941
城铁北苑华贸城 国际城 精装两居可长签 可月付 拎包住,85,7500,88.23529412
北苑5立水桥南站 望春园 精装两居两卫 随时入住 免押金,108,7500,69.44444444
北苑0押金房租月付 城铁北苑13 华贸城精装次卧 随时看房,15,2100,140
北苑5 立水桥南 精装全南大两居 拎包入住 看房方便,89,7200,80.8988764
新上 华贸城精装三居 业主装修 可长签 随时住可看房,100,9999,99.99
北苑家园筑华年 花园一样的小区 南北通透 安静 拎包入住长签,106,7600,71.69811321
来北家园小区 一室一厅全新装修 一次出租 提包入住,65,5500,84.61538462
5立水桥南铁站 北苑家园精装两居室 拎包入住 免押月付,93,7200,77.41935484
北苑家园 望春园 精装两居室 看房方便 人车分流 拎包住,85,7000,82.35294118
北苑茉藜园 30平主卧独卫 带阳台 南向 采光好 秒租,30,3000,100
13北苑站 华贸城 0押金房租月付南向飘窗 主卧 独卫,30,3500,116.6666667
"奥森公园,林奥嘉园主卧独卫,小区环境好,随时入住,零压月付",31,3600,116.1290323
"急租华发颐园三居室,交通便利,采光好,随时看房,零压月付",126,12000,95.23809524
新上好房 望春园精美主卧 三家合住 家电齐 零押金月付+飘窗,30,2777,92.56666667
店长推荐103平7500元口,103,7500,72.81553398
华贸城 业主房源 看好随时签约 店长推荐!,55,5300,96.36363636
华贸城 3居室 81平米 看好随时签约!,81,11000,135.8024691
华贸城 2居室 稳定 店长推荐,95,7800,82.10526316
华贸城 正规南1居室 看好随时签约,57,6000,105.2631579
华贸城 1居改2居室 紧凑 看好随时签约!,67,6000,89.55223881
华贸城 2居室 稳定 看好能签约,67,6000,89.55223881
华贸城 3居室 稳定 看好随时签约,100,8500,85
华贸城 1居室室 稳定签约,53,5600,105.6603774
华贸城 稳定出租 55平米 店长推荐,55,4800,87.27272727
华贸城 大开间 55平米 着急出租!,55,4500,81.81818182
华贸城 全南2居室 可短租 看好随时签约 看房有钥匙,95,6500,68.42105263
华贸城 2居室 独特风格 看房有钥匙 看好随时签约!,53,6500,122.6415094
华贸城 看房方便 稳定,54,5000,92.59259259
华贸城 55平米 稳定 看好随时签约 店长推荐,55,5000,90.90909091
国际城 正规1居室 家具齐全 稳定 看房有钥匙 南北通透 边户!,54,5500,101.8518519
"北苑华贸城,世华泊郡精准装三居家电家具齐全长租",136,9500,69.85294118
业主直租 真是图片 带花园 带,140,13000,92.85714286
正规两居室可,78,8500,108.974359
铁建广场两居可,75,6500,86.66666667
"北苑美立方,豪装南北两居,出租,可长签两年,看房随时!",96,6800,70.83333333
北苑朝阳北苑润泽悦溪 精装两居 南北通透 家具家电齐全 随时入住,90,7200,80
北苑山水蓝维精装两居室出租+0押金可月付+随时看房+家具家电齐全,98,7300,74.48979592
北苑0押金月付 华贸城 精装全南向 两居室13,96,7500,78.125
北苑世华泊郡华贸主卧独卫出租13附近采光好,30,3499,116.6333333
润泽公馆 1室1厅 装修豪华 拎包入住,60,6800,113.3333333
"傲城融富大三居房,配套齐全,临,随时看房随时用",168,17000,101.1904762
北苑 美立方精装两开间全南朝向 高层观景家具家电齐全,53,5200,98.11320755
