房源名称,面积,租金,单平米租金
山水蓝维新上豪装两居室 业主诚租 有钥匙看房方便,98,8800,89.79591837
山水蓝维新上南北两居室 有钥匙 随时看房 业主诚租,98,8200,83.67346939
媒体村天畅园新上房 西南朝向 有钥匙 随时看房 欲租从速,180,19000,105.5555556
媒体村天畅园新上把边户型大三居 散光相当好 有钥匙 随时看房,180,19000,105.5555556
媒体村新上房 全明格局 地理优越至极,163,18000,110.4294479
媒体村天畅园新上把边房 有钥匙 随时看房 气氛浓郁,163,18000,110.4294479
媒体村天畅园新上大三居 户型 大三居 只缺的你,183,18000,98.36065574
媒体村天畅园新上大三居 业主好说话 价钱可以谈 使劲谈,183,18000,98.36065574
天畅园新上房 有钥匙 随时看房 空房 空调,133,12000,90.22556391
媒体村天畅园全西三居 空房可 有钥匙 随时看房 欲租从速,133,12000,90.22556391
媒体村天畅园新上房 有钥匙 随时看房 业主好说话 价钱可谈,186,18000,96.77419355
媒体村天畅园新上空房大三居 西北朝向 有钥匙 随时看房,186,18000,96.77419355
媒体村天畅园新上353平大房子 会客室 会议室 都有,353,41000,116.1473088
媒体村新上房 会客厅 会议室 工作室 全有 有班车 随时看房,460,80000,173.9130435
媒体村天畅园 新上大房子 白领 国企单位 集团手选之地,460,80000,173.9130435
奥森旁天月园底商出租 地下一层地上两层 有钥匙 随时看房,500,105000,210
天润福熙大道新上三居室 全新配置 头回出租 有钥匙 随时看房,166,20000,120.4819277
媒体村天月园新上豪装三居室 南北通透 有钥匙 随时看房,137,13000,94.89051095
媒体村天月园新上南北三居室 有钥匙 看房方便 临奥森公园,137,13000,94.89051095
"物业直租,旭辉奥都,精装一居,家电齐全,随时入住",50,5000,100
"物业直租,旭辉奥都,精装一居,家电齐全,随时入住",56,5200,92.85714286
"物业直租,旭辉奥都,精装两居,家电齐全,随时入住",90,7000,77.77777778
"物业直租,旭辉奥都,精装两居,家电齐全,随时入住",100,7500,75
林奥嘉园新上豪装三居室 南北通透 奥林匹克公园 全明格局,142,12500,88.02816901
林奥嘉园新上南北三居室 奥森公园 全明格局 业主头回出租,142,12500,88.02816901
林奥嘉园新上南北三居室 奥林匹克公园 全明格局 业主头回出,142,12500,88.02816901
林奥嘉园新上南北大三居 小区环境好 奥林匹克花园,142,12500,88.02816901
"物业直租,旭辉奥都,精装一居,家电齐全,随时入住",50,4900,98
"物业直租,旭辉奥都,精装两居,家电齐全,随时入住",90,7300,81.11111111
"物业直租,旭辉奥都,精装一居,家电齐全,随时入住",48,5200,108.3333333
"物业直租,旭辉奥都,精装一居,家电齐全,随时入住",90,7500,83.33333333
"物业直租,旭辉奥都,精装一居,家电齐全,随时入住",49,5100,104.0816327
"物业直租,旭辉奥都,精装两居,家电齐全,随时入住",90,7400,82.22222222
润泽公馆新上豪装南北三居室 商圈 小区 只缺的你,144,13000,90.27777778
润泽公馆新上南北三居室 业主只租爱护家的一家人 不可合租,144,13000,90.27777778
润泽公馆南北三居 别墅区中的高层 做人就得高人一等 不只十几米,144,13000,90.27777778
润泽公馆新上高层南北三居室 别墅区中的高层 做人就得高人一头,144,13000,90.27777778
"物业直租,旭辉奥都,精装一居,家电齐全,随时入住",53,5200,98.11320755
"物业直租,旭辉奥都,精装两居,家电齐全,随时入住",90,7500,83.33333333
"物业直租,旭辉奥都,精装一居,家电齐全,随时入住",56,5200,92.85714286
"物业直租,旭辉奥都,精装两居,家电齐全,随时入住",90,7500,83.33333333
"物业直租,旭辉奥都,精装一居,家电齐全,随时入住",47,5000,106.3829787
"物业直租,旭辉奥都,精装一居,家电齐全,随时入住",60,5300,88.33333333
"物业直租,旭辉奥都,精装两居,家电齐全,随时入住",90,7200,80
"物业直租,旭辉奥都,精装两居,家电齐全,随时入住",90,7500,83.33333333
旭辉26街区两室好房出租 承接房屋代理托管 刚收房!,38,2800,73.68421053
"旭辉26街区,不临街,安静舒适大一居室!配现代浅色家具",38,2600,68.42105263
"旭辉26街区,不临街,安静舒适大一居室!配现代浅色家具",38,2600,68.42105263
旭辉26街区两室好房出租 承接房屋代理托管 刚收房!,38,2800,73.68421053
"旭辉26街区,南法信站南行200米路东,可以配齐家具家电。",28,2200,78.57142857
"旭辉26街区,不临街,安静舒适大一居室!配现代浅色家具",38,2600,68.42105263
旭辉26街区两室好房出租 承接房屋代理托管 刚收房!,38,2800,73.68421053
"旭辉26街区,南法信站南行200米路东,可以配齐家具家电。",28,2200,78.57142857
"旭辉26街区,不临街,安静舒适大一居室!配现代浅色家具",38,2600,68.42105263
"旭辉26街区,南法信站南行200米路东,可以配齐家具家电。",28,2200,78.57142857
"旭辉26街区,不临街,安静舒适大一居室!配现代浅色家具",38,2600,68.42105263
旭辉26街区两室好房出租 承接房屋代理托管 刚收房!,38,2800,73.68421053
"旭辉26街区,南法信站南行200米路东,可以配齐家具家电。",28,2200,78.57142857
"旭辉26街区,南向300米就到,可步行,根据租户需求配家具家电。",28,2350,83.92857143
"旭辉26街区一居室,两居室出租!承接房屋代理托管 刚收房!",38,2800,73.68421053
旭辉26街区两室好房出租 承接房屋代理托管 刚收房!,38,2800,73.68421053
旭辉26街区两室好房出租 承接房屋代理托管 刚收房!,38,2800,73.68421053
旭辉26街区两室好房出租 承接房屋代理托管 刚收房!,38,2800,73.68421053
北苑家园绣菊园小区出租正规两居室看房随时,98,7000,71.42857143
"物业直租,旭辉奥都,精装一居,家电齐全,随时入住",56,5000,89.28571429
"物业直租,旭辉奥都,精装两居,家电齐全,随时入住",90,7500,83.33333333
"物业直租,旭辉奥都,精装一居,家电齐全,随时入住",48,5000,104.1666667
"物业直租,旭辉奥都,精装两居,家电齐全,随时入住",90,7500,83.33333333
世茂奥林+南向2居室+北苑+安立路+清林路1号+8号线+奥森公园,128,14500,113.28125
旭辉26街区两室好房出租 承接房屋代理托管 刚收房!,38,4200,110.5263158
旭辉26街区两室好房出租 承接房屋代理托管 刚收房!,38,4200,110.5263158
"物业直租,旭辉奥都,精装一居,家电齐全,随时入住",57,5000,87.71929825
"物业直租,旭辉奥都,精装两居,家电齐全,随时入住",90,7500,83.33333333
"物业直租,旭辉奥都,精装一居,家电齐全,随时入住",50,5000,100
"物业直租,旭辉奥都,精装两居,家电齐全,随时入住",90,7500,83.33333333
"物业直租,旭辉奥都,精装一居,家电齐全,随时入住",56,5000,89.28571429
"物业直租,旭辉奥都,精装两居,家电齐全,随时入住",90,7500,83.33333333
丙丙 天居园媒体村 空置 有钥匙 价位可谈 临地铁奥森,135,8200,60.74074074
丙丙 媒体村 天畅园 房 环境位置 氛围好,104,8000,76.92307692
丙丙 5号线 媒体村傲城融富 精装大开间 室内干净,76,7600,100
丙丙 媒体村 奥森 天溪园中叠别墅 带阳光 车位 有钥匙,180,22000,122.2222222
丙丙 天居园 无忧无虑的社区 环境优雅 干净整洁!,105,8800,83.80952381
丙丙 万科星园 交通便利 家具家电齐全 采光好 奥森公园,91,8800,96.7032967
丙丙 北苑 上元君庭 精装大两居业主诚意出租 照片是我拍的,103,8000,77.66990291
丙丙 媒体村 美立方 精装修 有钥匙 价位可谈 临地铁奥森,55,4800,87.27272727
丙丙 媒体村 傲城融富 高层观景 房管 看房随时,163,16000,98.1595092
丙丙 万科星园旁上元君庭 有钥匙 随时看房 拎包入住,56,4500,80.35714286
丙丙航空地铁站拂林园126平西向精装两居8200元月家具齐全,126,8200,65.07936508
"美立方 复式 媒体村,大空房,可,看房可以联系我",110,7500,68.18181818
天畅园190平西南向70平厅送观景阳台1.66万签两年实景图,190,15000,78.94736842
媒体村 天居园 2居室 精装修 家具家电齐全整租,69,5800,84.05797101
美立方 精装上一居室 家电齐全 交通便利 有钥匙,110,6200,56.36363636
北苑 天畅园 天居园 北向开间 有车位业主 出租,55,5000,90.90909091
(真实)南向大两居仅租10300价格能聊 配置齐全整租,138,10300,74.63768116
丙丙 媒体村 天畅园 带车位 空房 楼层好 好房 不临街,189,16000,84.65608466
丙丙 傲城房 采光好 空气流通好 真实图片 干净,235,26500,112.7659574
"丙丙媒体村天畅园精装如此正规的2室,你还在等什么整租",103,8000,77.66990291
丙丙 美立方 豪装一居 婚房出租 看房方便,57,4800,84.21052632
针房源世茂奥林花园新出三居 正南正北 有钥匙 随时看,198,22000,111.1111111
"世茂奥林花园,万达大湖,两室两厅,观景,舒适,温馨,家的感觉",118,11500,97.45762712
"世茂奥林花园 豪装三居 小区化境优美 安静幽雅 有钥匙,随时",198,21000,106.0606061
针房源世茂奥林花园新出三居 正南正北 有钥匙 随时看,198,22000,111.1111111
世茂奥林花园豪装三居室带车位小区环境无可媲美随时可看,183,16000,87.43169399
世茂奥林花园 经典两居户型 小区环境美 奥森 有车位哦,128,13000,101.5625
"物业直租,旭辉奥都,精装一居,家电齐全,随时入住",56,5000,89.28571429
"物业直租,旭辉奥都,精装两居,家电齐全,随时入住",90,7500,83.33333333
"物业直租,旭辉奥都,精装一居,家电齐全,随时入住",53,5000,94.33962264
"物业直租,旭辉奥都,精装两居,家电齐全,随时入住",90,7500,83.33333333
"物业直租,旭辉奥都,精装一居,家电齐全,随时入住",56,5200,92.85714286
"物业直租,旭辉奥都,精装两居,家电齐全,随时入住",90,7500,83.33333333
"物业直租,旭辉奥都,朝南主卧,家电齐全,随时入住",90,2500,27.77777778
"物业直租,旭辉奥都,正规次卧,家电齐全,随时入住",90,2000,22.22222222
"物业直租,旭辉奥都,合住单间,家电齐全,随时入住",90,1500,16.66666667
针房源世茂奥林花园新出三居 正南正北 有钥匙 随时看,198,22000,111.1111111
"世茂奥林花园 豪装三居 小区化境优美 安静幽雅 有钥匙,随时",198,21000,106.0606061
世茂奥林花园豪装三居室带车位小区环境无可媲美随时可看,183,16000,87.43169399
世茂奥林花园 经典两居户型 小区环境美 奥森 有车位哦,128,13000,101.5625
"世茂奥林花园,万达大湖,两室两厅,观景,舒适,温馨,家的感觉",118,11500,97.45762712
针房源世茂奥林花园新出三居 正南正北 有钥匙 随时看,198,22000,111.1111111
立水桥南站 美立方 精装复式 的优先选择,112,10000,89.28571429
北苑地铁13号线 采光充足 周边配套设施成熟 地铁,52,7800,150
假壹赔百!真实图片!北苑筑华年三居7400元出租!可同事合住,100,7400,74
5号.线立水桥南站 望春园新出南北通透两居室 小区环境优美,116,7300,62.93103448
"铁13号线华贸城精装三居室家电齐全,看房方便",95,10200,107.3684211
物业出租望春园 华发颐园旭辉奥都拎包入住 随时入住,90,7500,83.33333333
旭辉奥都 精装新房源 业主 看房预约 随时签约,95,7000,73.68421053
开门见喜 精装立水桥南 南向一居室 全新装修 随时看,65,5100,78.46153846
立水桥南 北苑 旭辉奥都 豪华一居室 随时看 家电家具全新,70,6000,85.71428571
立水桥南茉藜园精装两居、超格、家具齐全、随时入住!!,118,6000,50.84745763
"铁13号线华贸城精装三居室家电齐全,看房方便",95,10200,107.3684211
假壹赔百!真实图片!北苑筑华年三居7400元出租!可同事合住,100,7400,74
5号.线立水桥南站 望春园新出南北通透两居室 小区环境优美,116,7300,62.93103448
物业直租 北苑美立方 华发颐园旭辉奥都 一居室 随时入租,50,5100,102
物业出租望春园 华发颐园旭辉奥都拎包入住 随时入住,90,7500,83.33333333
北苑立水桥旭辉奥都75平豪华一居婚房首租奢华真实照片视频,75,6500,86.66666667
北苑绣菊园 精装一居室 5号线北苑路北站 这么低的价格不多啦,72,5100,70.83333333
立水桥南地铁边环科苑 精装两居 干净整洁 0押金可月付,80,6800,85
5号线立水桥南旭辉奥都 豪装开间 看房方便 家具齐全,55,4950,90
丙丙 林奥嘉园南向观景房 奥森过马路即到 看房方便,25,3200,128
丙丙 媒体村新出奥森北门林奥嘉园 南北2居 好房,130,8200,63.07692308
"物业直租,旭辉奥都,精装一居,家电齐全,随时入住",53,5200,98.11320755
"物业直租,旭辉奥都,精装两居,家电齐全,随时入住",90,7500,83.33333333
"物业直租,旭辉奥都,精装一居,家电齐全,随时入住",50,5000,100
"物业直租,旭辉奥都,精装两居,家电齐全,随时入住",90,7500,83.33333333
新出 北苑 润泽公馆 空房出租 南北通透 采光好 租期可面谈,145,12000,82.75862069
头次出租 婚房欧式华装修 全南三居 带家具可长租 随时入住,112,12500,111.6071429
润泽公馆 大三居 交通便利 配套齐全 舒适温馨 业主直租,148,12000,81.08108108
北苑润泽公馆三居精装修家具家电齐全采光好13号方便,120,11500,95.83333333
北苑 旭辉奥都 豪装两居 老业主的房 可以长签,90,7500,83.33333333
北苑奥森旁+大三居户型方正+高层观景+装修+家电全齐亚奥,140,14000,100
"朝阳北苑铁13号线华贸城精装三居室家电齐全,看房方便",95,10150,106.8421053
地铁13号线 润泽悦溪南北大两居出租 刚做完保洁 随时看房,88,8000,90.90909091
北苑家园望春园 正规大两居 业主初次出租 看房随时,115,6450,56.08695652
茉藜园精装修大三居 首.次出租 入住随时 业主直租 看房可约,128,8800,68.75
"紫绶园两居室,优惠多多,家具家电齐全,交通便捷",79,6000,75.94936709
望春园正规一居 首.次出租 业主直租可长签 看好随时腾房,65,5350,82.30769231
婚房豪装南北两居室 北苑家园 望春园 临地铁5号线 环境优美,110,7300,66.36363636
"世茂奥临花园,265平4居,豪华装修奥森,交通便利",265,25000,94.33962264
北苑家园清友园 业主精装两居室 全家电 干净整洁 随时,110,7000,63.63636364
媒体村 天溪园 五居室 下叠拼别墅 南北通透 带花园,230,38000,165.2173913
北苑青年城开间 家具家电齐全 可长租 押0月付,40,4300,107.5
媒体村 天溪园 五居室 下叠拼别墅 南北通透 带花园,230,38000,165.2173913
华发颐园南北精装三居 家具齐全 干净整洁 长期租 随时看,138,13500,97.82608696
北苑 润泽区 北京华贸城 新上三居室 业主直租 看房有钥匙,110,10266,93.32727273
北苑 润泽公馆 南北大三居 带车位 室内干净整洁 拎包住,148,15500,104.7297297
北苑家园茉藜园精装三居室 有钥匙 拎包入住 随时看房,110,9800,89.09090909
城铁13号线 铁建国际城 正规居家大两居 装修不错 拎包入住,105,8000,76.19047619
整租 天怡家园 南向两居 茉藜园西边小区 房主首租,94,6950,73.93617021
北苑家园 茉藜园 绣南 精装西南 两居两卫 随时看房,116,7000,60.34482759
南北两居首/租 北苑立水桥 望春园 采光好 房子新随时看!,110,7050,64.09090909
中国铁建国际城 南北通透 亚奥核心商圈 家具家电齐全,129,12800,99.2248062
北苑家园 茉藜园 南向主卧 次卧 随时入住 0押金,121,2180,18.01652893
北苑清友园 大两居 装修好 适合一家人住 看房方便 好房秒租,104,7000,67.30769231
北苑 急租 福熙大道山水蓝维大三居室,150,13000,86.66666667
"福熙大道同比润泽公馆,悦熙,南北通透四居室 装修好,",199,26000,130.6532663
朝阳 北苑清友园 南向带阳台 主卧独卫 家具家电齐全,153,2800,18.30065359
新上福熙大道首租+随时入住+0押金月付+租给爱惜房子的你,138,12000,86.95652174
北苑来北家园一居室 看房随时有钥匙 蕴实园 恒大名都 青年城,65,5200,80
"中国铁建国际城,南北通透三居室,邻天润福熙大道,华贸城",119,12000,100.8403361
"5号线立水桥南,美立方精装三居,媒体村天居园天畅园北辰上品",98,7999,81.62244898
"北苑 美立方 精装南向大开间,铁旁,居家必备",50,5000,100
"华贸城乐想汇大开间,南向,精装修,集中供暖,近地铁",55,5200,94.54545455
北苑路北美立方 两家合住 主卧 次卧 独卫 拎包入住,102,2100,20.58823529
北苑 美立方5号旁 精装一居 美立方 随时入住 有钥匙,60,5500,91.66666667
美立方 2室1厅2卫个人,120,8500,70.83333333
天怡家园 3室2厅2卫个人,130,10700,82.30769231
北苑 立水桥 华发颐园 140平南北三居 家电齐全 零押月付,140,12500,89.28571429
13北苑家园 紫绶园正规南北三居室 家具家电齐全 可同事合住,94,7700,81.91489362
北苑筑华年正规三居室出租 真实图片 可同事合住 随时看房入住,100,7500,75
绣菊园精装南北三居室可朋友合住 随时看房 地铁北苑站菜市,108,8199,75.91666667
北苑家园望春园 婚房两居室 集中供暖 可月付 拎包住 近5,108,7500,69.44444444
朝阳北苑.林奥嘉园.安立路.奥森北门.南向次卧.厅隔,25,2400,96
"物业直租,旭辉奥都,合住单间,家电齐全,随时入住",8,1000,125
"物业直租,旭辉奥都,合住单间,家电齐全,随时入住",15,1000,66.66666667
"物业直租,旭辉奥都,精装单间,家电齐全,随时入住",15,2000,133.3333333
"物业直租,旭辉奥都,正规次卧,家电齐全,随时入住",20,2000,100
"铁13号线华贸城精装三居室家电齐全,看房方便",95,10200,107.3684211
立水桥南茉藜园精装两居、超格、家具齐全、随时入住!!,118,6000,50.84745763
物业直租 北苑美立方 华发颐园旭辉奥都 一居室 随时入租,50,5100,102
假壹赔百!真实图片!北苑筑华年三居7400元出租!可同事合住,100,7400,74
5号.线立水桥南站 望春园新出南北通透两居室 小区环境优美,116,7300,62.93103448
物业出租望春园 华发颐园旭辉奥都拎包入住 随时入住,90,7500,83.33333333
立水桥南站 美立方 精装复式 的优先选择,112,10000,89.28571429
北苑 美立方 精装两居 (押零付一)5号线 立水桥南站,65,6700,103.0769231
北苑地铁13号线 采光充足 周边配套设施成熟 地铁,52,7800,150
北苑旭辉奥都舒适好房清凉一夏铁204米!随时入住!,61,5000,81.96721311
"朝阳北苑,望春园,精装小三居,拎包入住入住,家具家电齐全",98,8000,81.63265306
北苑近奥森望春园南北2居!婚房首组+园林绿化+舒心安逸!,96,7000,72.91666667
北五环婚房两居 头回出租 家具全齐 干净整洁 找一家人,90,6850,76.11111111
5北苑路北站 拂林园精装卧室出租 家具齐全 拎包入住,26,2500,96.15384615
北苑媒体村 大两居出租 看房方便 好房 交通便利 速看,133,10000,75.18796992
新出 天朗园163平米房 看房随时有钥匙,163,17500,107.3619632
"北苑林奥嘉园,精装大一居,观奥森,采光好,0押金",75,7200,96
城锦苑南向主卧 住家少干净整洁 集中供暖 近地铁押0月付,28,2800,100
朝阳北苑.林奥嘉园.安立路.奥森北门.南向次卧.厅隔,25,2400,96
美立方 新上婚房两居 中国风装修 精装南向两居 随时起租,85,7500,88.23529412
5号线铁立水桥南望春园 业主婚房 品质家居 可长签,110,6700,60.90909091
北苑路北 天居园精装开间 干净整洁 温馨舒适 随时看房,59,5000,84.74576271
北苑 奥森北门林奥嘉园 天然氧吧 豪装两居 随时看房 拎包住,118,8300,70.33898305
5北苑路北 天然氧吧奥森公园北门 林奥嘉园 精装次卧,30,2600,86.66666667
林奥嘉园 天月园 精装全南2居 业主直租 慢无,118,10000,84.74576271
北苑 林奥嘉园主卧次卧 高层合租 铁干净整洁 奥森,20,2400,120
奥森国公园 林奥嘉园主卧次卧 高层合租 铁干净整洁 奥,20,2300,115
5北苑路北 天然氧吧奥森公园北门 林奥嘉园 精装主卧,30,3600,120
万科星园 出租三居室 精装修 拎包入住 随时看,138,14000,101.4492754
新上北苑旭辉奥都南北精装两居!随时入住!,90,7200,80
奥森+北苑华发颐园南北120平2室2卫+首租近地铁+实图,120,8500,70.83333333
北苑旭辉奥都舒适小两居!铁立水桥北苑站!业主首租!,90,6650,73.88888889
新上北苑望春园0押金月付+随时入住+齐全家电,94,6500,69.14893617
傲城融富天畅园领地大平米房户型方正利用,163,17000,104.2944785
城锦苑南向主卧 住家少干净整洁 集中供暖 近地铁押0月付,28,2800,100
北苑家园 林奥嘉园 精装大一居室 集中供暖 拎包住 可月付,70,6000,85.71428571
媒体村附近傲城户型 房出租 价低临 随时看房,232,28500,122.8448276
媒体村傲城融富165平西南向三居 有钥匙 长期出租,165,16500,100
站 北苑媒体村傲城融富165平西南三居70平厅送落地,165,16800,101.8181818
北苑 美立方 精装两居 (押零付一)5号线 立水桥南站,65,6700,103.0769231
"铁13号线华贸城精装三居室家电齐全,看房方便",95,10200,107.3684211
北苑地铁13号线 采光充足 周边配套设施成熟 地铁,52,7800,150
假壹赔百!真实图片!北苑筑华年三居7400元出租!可同事合住,100,7400,74
5号.线立水桥南站 望春园新出南北通透两居室 小区环境优美,116,7300,62.93103448
立水桥南站 美立方 精装复式 的优先选择,112,10000,89.28571429
朝阳北苑.林奥嘉园.安立路.奥森北门.南向次卧.厅隔,25,2400,96
美立方 新上婚房两居 中国风装修 精装南向两居 随时起租,85,7500,88.23529412
(0押金 可月付)立水桥 精装两居室 价格不贵 看房随时,90,6300,70
近5号线立水桥南 旭辉奥都 精装大两居 业主首租,95,6800,71.57894737
电梯两居+采光好 装修好+舒适 近地铁 生活便利<押0付,95,6600,69.47368421
立水桥南新上 旭辉奥都 精装两居 可零押金月付 300米铁,80,6500,81.25
(地铁五号线)北苑望春园精装大2居 业主直租 价位能谈,103,7800,75.72815534
北苑家园望春园 三居两卫 业主直租 看房打电话,90,9500,105.5555556
"5号线立水桥南,华发颐园婚房三居旭辉奥都美立方望春园附近北辰",122,12000,98.36065574
北苑 立水桥南站 筑华年 二改三 同事同学 合租好房集中供暖,100,8200,82
物业直租 北苑美立方 华发颐园旭辉奥都 一居室 随时入租,50,5100,102
北苑家园 单间出租 房子干净 看房随时,20,2500,125
物业出租望春园 华发颐园旭辉奥都拎包入住 随时入住,90,7500,83.33333333
北苑 旭辉奥都 精装两居 婚房 5号.线立水桥南站,96,7500,78.125
假壹赔百!真实图片!北苑筑华年三居7400元出租!可同事合住,100,7400,74
立水桥南茉藜园精装两居、超格、家具齐全、随时入住!!,118,6000,50.84745763
新出 天朗园163平米房 看房随时有钥匙,163,17500,107.3619632
"物业直租,旭辉奥都,正规次卧,家电齐全,随时入住",20,2000,100
旭辉奥都 精装一室一厅 有电梯 随时看拎包入住,55,4900,89.09090909
北苑家园 望春园主卧 三家合住 家电齐全 零押月付,30,2200,73.33333333
北苑家园 茉藜园 南向主卧 家电齐全 押零月付,25,2300,92
"立水桥 北苑 旭辉奥都 空房 可 随时看房,急租!",60,4700,78.33333333
北苑媒体村万科星园 精装大两居 高层 看奥森公园 拎包 急租,91,8800,96.7032967
北苑山水蓝维豪华装修大两居配套全环境好城铁,95,9200,96.84210526
山水蓝维精装两居室 拎包入住 业主直租,95,9500,100
山水二室一厅一卫,98,9200,93.87755102
北苑家园 单间出租 房子干净 看房随时,20,2500,125
立水桥南茉藜园精装两居、超格、家具齐全、随时入住!!,118,6000,50.84745763
北苑家园望春园 三居两卫 业主直租 看房打电话,90,9500,105.5555556
"5号线立水桥南,华发颐园婚房三居旭辉奥都美立方望春园附近北辰",122,12000,98.36065574
北苑 立水桥南站 筑华年 二改三 同事同学 合租好房集中供暖,100,8200,82
(地铁五号线)北苑望春园精装大2居 业主直租 价位能谈,103,7800,75.72815534
北苑 旭辉奥都 精装两居 婚房 5号.线立水桥南站,96,6600,68.75
甩租!旭辉奥都 0 押一付一 随时看房,29,2400,82.75862069
"立水桥 北苑 旭辉奥都 空房 可 随时看房,急租!",60,4500,75
北苑 万科星园 精装 力迈 奥森公园,125,13000,104
北苑 万科星园 精装三居 8月中下旬客入住,125,13000,104
北苑 万科星园 力迈国际 奥森公园 精装 含车位,125,14000,112
北苑 万科星园 力迈国际 奥森公园 精装 含车位,125,14000,112
北苑 万科星园 力迈国际 奥森公园 精装 含车位,125,14000,112
北苑 万科星园 力迈国际 奥森公园 精装 含车位,125,14000,112
北苑 万科星园 力迈国际 奥森公园 精装 含车位,125,13000,104
北苑路北铁 林奥嘉园主卧独卫+次卧+厅隔押0月付实房实拍,30,3800,126.6666667
旁领地 大三居 赠送地下室和小院哦!,170,15600,91.76470588
北苑路北 林奥嘉园 2居改3居室2卫 可整租可分租押0月付,128,10800,84.375
天怡家园旁北苑6号院精装三居室 业主急租 家具齐全 有钥匙,95,8000,84.21052632
零押金+月付 北苑路北 精装三居室 可同事合租 有钥匙 随时,118,10300,87.28813559
